{
  "$schema": "./skills.schema.json",
  "version": "1.0.0",
  "taxonomy": "Jaguar Math",
  "description": "Canonical G11/G12 Jaguar Math skill taxonomy. AERO is the curriculum alignment; SAT and ICFES are assessment overlays.",
  "skill_count": 125,
  "skills": [
    {
      "code": "NUM.ORDER_OPS",
      "domain": "Number & Quantitative Reasoning",
      "subdomain": "Arithmetic",
      "name": "Use order of operations accurately",
      "sort_order": 1,
      "active": true,
      "aero": {
        "status": "prerequisite",
        "standards": []
      },
      "sat": {
        "status": "supporting",
        "domain": null,
        "skills": []
      },
      "icfes": {
        "status": "direct",
        "category": "Álgebra y cálculo",
        "content_type": "Genérico"
      },
      "notes": "Foundational prerequisite; ICFES includes basic arithmetic operations."
    },
    {
      "code": "NUM.INTEGER_OPS",
      "domain": "Number & Quantitative Reasoning",
      "subdomain": "Arithmetic",
      "name": "Perform operations with integers and signed numbers",
      "sort_order": 2,
      "active": true,
      "aero": {
        "status": "prerequisite",
        "standards": []
      },
      "sat": {
        "status": "supporting",
        "domain": null,
        "skills": []
      },
      "icfes": {
        "status": "direct",
        "category": "Álgebra y cálculo",
        "content_type": "Genérico"
      }
    },
    {
      "code": "NUM.FRACTIONS",
      "domain": "Number & Quantitative Reasoning",
      "subdomain": "Arithmetic",
      "name": "Perform operations with fractions and mixed numbers",
      "sort_order": 3,
      "active": true,
      "aero": {
        "status": "prerequisite",
        "standards": []
      },
      "sat": {
        "status": "supporting",
        "domain": "Problem-Solving and Data Analysis",
        "skills": [
          "Ratios, rates, proportional relationships, and units"
        ]
      },
      "icfes": {
        "status": "direct",
        "category": "Álgebra y cálculo",
        "content_type": "Genérico"
      }
    },
    {
      "code": "NUM.DECIMALS",
      "domain": "Number & Quantitative Reasoning",
      "subdomain": "Arithmetic",
      "name": "Perform operations with decimals",
      "sort_order": 4,
      "active": true,
      "aero": {
        "status": "prerequisite",
        "standards": []
      },
      "sat": {
        "status": "supporting",
        "domain": "Problem-Solving and Data Analysis",
        "skills": [
          "Percentages"
        ]
      },
      "icfes": {
        "status": "direct",
        "category": "Álgebra y cálculo",
        "content_type": "Genérico"
      }
    },
    {
      "code": "NUM.RATIOS_RATES",
      "domain": "Number & Quantitative Reasoning",
      "subdomain": "Proportional Reasoning",
      "name": "Work with ratios, rates, and unit rates",
      "sort_order": 5,
      "active": true,
      "aero": {
        "status": "direct",
        "standards": [
          "AERO.HSN.Q.1"
        ]
      },
      "sat": {
        "status": "direct",
        "domain": "Problem-Solving and Data Analysis",
        "skills": [
          "Ratios, rates, proportional relationships, and units"
        ]
      },
      "icfes": {
        "status": "direct",
        "category": "Álgebra y cálculo",
        "content_type": "Genérico"
      }
    },
    {
      "code": "NUM.PROPORTIONS",
      "domain": "Number & Quantitative Reasoning",
      "subdomain": "Proportional Reasoning",
      "name": "Solve proportional relationships",
      "sort_order": 6,
      "active": true,
      "aero": {
        "status": "direct",
        "standards": [
          "AERO.HSN.Q.1",
          "AERO.HSF.LE.1"
        ]
      },
      "sat": {
        "status": "direct",
        "domain": "Problem-Solving and Data Analysis",
        "skills": [
          "Ratios, rates, proportional relationships, and units"
        ]
      },
      "icfes": {
        "status": "direct",
        "category": "Álgebra y cálculo",
        "content_type": "Genérico"
      }
    },
    {
      "code": "NUM.PERCENT",
      "domain": "Number & Quantitative Reasoning",
      "subdomain": "Proportional Reasoning",
      "name": "Solve percent problems and percent change",
      "sort_order": 7,
      "active": true,
      "aero": {
        "status": "partial",
        "standards": [
          "AERO.HSN.Q.1"
        ]
      },
      "sat": {
        "status": "direct",
        "domain": "Problem-Solving and Data Analysis",
        "skills": [
          "Percentages"
        ]
      },
      "icfes": {
        "status": "direct",
        "category": "Álgebra y cálculo",
        "content_type": "Genérico"
      }
    },
    {
      "code": "NUM.UNITS",
      "domain": "Number & Quantitative Reasoning",
      "subdomain": "Measurement",
      "name": "Convert units and use dimensional analysis",
      "sort_order": 8,
      "active": true,
      "aero": {
        "status": "direct",
        "standards": [
          "AERO.HSN.Q.1-3"
        ]
      },
      "sat": {
        "status": "direct",
        "domain": "Problem-Solving and Data Analysis",
        "skills": [
          "Ratios, rates, proportional relationships, and units"
        ]
      },
      "icfes": {
        "status": "direct",
        "category": "Álgebra y cálculo",
        "content_type": "Genérico"
      }
    },
    {
      "code": "NUM.SCI_NOTATION",
      "domain": "Number & Quantitative Reasoning",
      "subdomain": "Number Systems",
      "name": "Use scientific notation and orders of magnitude",
      "sort_order": 9,
      "active": true,
      "aero": {
        "status": "partial",
        "standards": [
          "AERO.HSN.Q.3"
        ]
      },
      "sat": {
        "status": "supporting",
        "domain": "Advanced Math",
        "skills": [
          "Equivalent expressions"
        ]
      },
      "icfes": {
        "status": "direct",
        "category": "Álgebra y cálculo",
        "content_type": "Genérico"
      }
    },
    {
      "code": "NUM.ESTIMATION",
      "domain": "Number & Quantitative Reasoning",
      "subdomain": "Quantitative Reasoning",
      "name": "Estimate, approximate, and judge reasonableness",
      "sort_order": 10,
      "active": true,
      "aero": {
        "status": "direct",
        "standards": [
          "AERO.HSN.Q.3"
        ]
      },
      "sat": {
        "status": "supporting",
        "domain": "Problem-Solving and Data Analysis",
        "skills": [
          "Ratios, rates, proportional relationships, and units"
        ]
      },
      "icfes": {
        "status": "direct",
        "category": "Álgebra y cálculo",
        "content_type": "Genérico"
      }
    },
    {
      "code": "NUM.REAL_NUMBERS",
      "domain": "Number & Quantitative Reasoning",
      "subdomain": "Number Systems",
      "name": "Classify and compare rational, irrational, and real numbers",
      "sort_order": 11,
      "active": true,
      "aero": {
        "status": "direct",
        "standards": [
          "AERO.HSN.RN.3"
        ]
      },
      "sat": {
        "status": "supporting",
        "domain": "Advanced Math",
        "skills": [
          "Equivalent expressions"
        ]
      },
      "icfes": {
        "status": "supporting",
        "category": "Álgebra y cálculo",
        "content_type": "No genérico"
      }
    },
    {
      "code": "ALG.EXPRESSIONS",
      "domain": "Algebra",
      "subdomain": "Expressions",
      "name": "Simplify and evaluate algebraic expressions",
      "sort_order": 12,
      "active": true,
      "aero": {
        "status": "direct",
        "standards": [
          "AERO.HSA.SSE.1-2"
        ]
      },
      "sat": {
        "status": "direct",
        "domain": "Advanced Math",
        "skills": [
          "Equivalent expressions"
        ]
      },
      "icfes": {
        "status": "direct",
        "category": "Álgebra y cálculo",
        "content_type": "No genérico"
      }
    },
    {
      "code": "ALG.EQUIVALENT_EXPRESSIONS",
      "domain": "Algebra",
      "subdomain": "Expressions",
      "name": "Rewrite expressions in equivalent forms to reveal structure",
      "sort_order": 13,
      "active": true,
      "aero": {
        "status": "direct",
        "standards": [
          "AERO.HSA.SSE.2-3"
        ]
      },
      "sat": {
        "status": "direct",
        "domain": "Advanced Math",
        "skills": [
          "Equivalent expressions"
        ]
      },
      "icfes": {
        "status": "direct",
        "category": "Álgebra y cálculo",
        "content_type": "No genérico"
      }
    },
    {
      "code": "ALG.REARRANGE_FORMULAS",
      "domain": "Algebra",
      "subdomain": "Expressions",
      "name": "Rearrange formulas and literal equations",
      "sort_order": 14,
      "active": true,
      "aero": {
        "status": "direct",
        "standards": [
          "AERO.HSA.CED.4"
        ]
      },
      "sat": {
        "status": "supporting",
        "domain": "Algebra",
        "skills": [
          "Linear equations in one variable"
        ]
      },
      "icfes": {
        "status": "direct",
        "category": "Álgebra y cálculo",
        "content_type": "No genérico"
      }
    },
    {
      "code": "ALG.ABSOLUTE_VALUE",
      "domain": "Algebra",
      "subdomain": "Equations & Inequalities",
      "name": "Solve and interpret absolute-value equations and inequalities",
      "sort_order": 15,
      "active": true,
      "aero": {
        "status": "partial",
        "standards": [
          "AERO.HSA.REI.3",
          "AERO.HSF.IF.7"
        ]
      },
      "sat": {
        "status": "direct",
        "domain": "Advanced Math",
        "skills": [
          "Nonlinear equations in one variable"
        ]
      },
      "icfes": {
        "status": "direct",
        "category": "Álgebra y cálculo",
        "content_type": "No genérico"
      }
    },
    {